{
  "batch_collection_version": "1.0",
  "debate_id": "les_hommes_doivent_ils_rejoindre_le_combat_feministe",
  "language": "fr",
  "batches": [
    {
      "batch_schema_version": "1.0",
      "id": "FR-A-001",
      "debate_id": "les_hommes_doivent_ils_rejoindre_le_combat_feministe",
      "language": "fr",
      "page_type": "argument",
      "strategy": "size_balanced",
      "root_node_ids": [
        "A0001",
        "A0002",
        "A0003",
        "A0004",
        "A0005",
        "A0006",
        "A0007",
        "A0008",
        "A0009",
        "A0010"
      ],
      "node_ids": [
        "A0001",
        "A0002",
        "A0003",
        "A0004",
        "A0005",
        "A0006",
        "A0007",
        "A0008",
        "A0009",
        "A0010",
        "A0011",
        "A0012",
        "A0013",
        "A0014",
        "A0015",
        "A0016",
        "A0017",
        "A0018",
        "A0019",
        "A0020",
        "A0021",
        "A0022",
        "A0023",
        "A0024",
        "A0025",
        "A0026",
        "A0027",
        "A0028",
        "A0029",
        "A0030",
        "A0031",
        "A0032",
        "A0033",
        "A0034",
        "A0035",
        "A0036",
        "A0037",
        "A0038",
        "A0039",
        "A0040",
        "A0041",
        "A0042",
        "A0043",
        "A0044",
        "A0045",
        "A0046",
        "A0047",
        "A0048",
        "A0049",
        "A0050",
        "A0051",
        "A0052",
        "A0053",
        "A0054",
        "A0055",
        "A0056",
        "A0057",
        "A0058",
        "A0059",
        "A0060",
        "A0061",
        "A0062",
        "A0063",
        "A0064",
        "A0065",
        "A0066",
        "A0067",
        "A0068",
        "A0069",
        "A0070",
        "A0071",
        "A0072",
        "A0073",
        "A0074",
        "A0075",
        "A0076",
        "A0077",
        "A0078",
        "A0079",
        "A0080",
        "A0081",
        "A0082",
        "A0083",
        "A0084",
        "A0085",
        "A0086",
        "A0087",
        "A0088",
        "A0089",
        "A0090",
        "A0091",
        "A0092",
        "A0093",
        "A0094",
        "A0095",
        "A0096",
        "A0097",
        "A0098",
        "A0099",
        "A0100"
      ],
      "dependency_node_ids": [],
      "status": "validated",
      "inputs": {
        "registry_sha256": "95b9c8269c8bbb2c04c38e6754e4e4936f0c639803619bc6fdd1dc4188ffea35",
        "structural_sha256": "83262089d6216339a5c54f338590b92823df30e58cea1ade1a06d1eadc5fc3c9",
        "render_profile_version": "1.0",
        "handoff_path": null
      },
      "outputs": {
        "individual_directory": "output/fr/arguments",
        "aggregate_path": "output/fr/aggregates/arguments_batch_001.wiki",
        "aggregate_sha256": "c16b633f9ab539a38b8905885ac88522a5dc758a454df75c781201dff423a02a",
        "report_path": "reports/fr_batch_001.txt"
      },
      "work": {
        "work_id": "EDIT-20261023-001-FR-RENDER",
        "conversation_name": "Rendu déterministe des arguments fr",
        "started_at": "2026-10-23T06:34:51+00:00",
        "completed_at": "2026-10-23T06:34:51+00:00"
      }
    }
  ]
}
